Key,Value
Metadata_URL,https://sportsorthopedics.in/achilles-tendinopathy-recovery-time/
Metadata_Type,post
Metadata_Title,Achilles Tendinopathy Recovery Time: What to Expect | Sports Orthopedics
Metadata_Scraped,2025-04-05T17:45:53.218Z
PageTitle,"February 1, 2025"
Heading,Achilles Tendinopathy Recovery Time: What to Expect
Paragraph,How long does Achilles tendinopathy recovery take? Discover how early intervention and personalized care impact healing and help you get back to your sport safely.
Heading,Why Achilles Tendinopathy Recovery Matters
Paragraph,"Achilles tendinopathy recovery is crucial for athletes and active folks. This condition messes with your game, causing pain and holding back your performance. Understanding recovery time is key. It helps you manage expectations and make smart choices about treatment. Knowing when you’ll be back on your feet (literally) is empowering.
Getting a grip on the recovery timeline means fewer surprises. You can plan your return to sports or activities without rushing it. The last thing you want is a reinjury because you jumped the gun. Recovery isn’t just about healing; it’s about doing it right to stay strong in the long run.
Early intervention can make all the difference. Catching the issue early can shrink recovery time and lead to better outcomes. You’ll be back to doing what you love before you know it. Plus, early treatment helps avoid long-term issues that could keep you benched longer than necessary.
Sports Orthopedics Institute offers personalized care to help with this. We understand what it takes to get you back in action. Our team provides clear information and expert treatment, ensuring your recovery journey is as smooth as possible. Keep your performance in check by understanding and respecting recovery time."
Heading,Understanding Achilles Tendinopathy
Paragraph,"Achilles tendinopathy causes pain and degeneration in the Achilles tendon. This tendon connects your calf muscles to your heel bone. It’s vital for walking, running, and jumping. A healthy Achilles tendon lets you move without pain.
Tendinopathy disrupts normal function. You might feel pain, swelling, and stiffness after activity. Overuse often causes this, especially from intense sports. Poor footwear can also lead to problems. Sudden increases in exercise can strain the tendon. For those experiencing persistent pain, exploring advanced treatment options for Achilles tendinopathy in Bangalore can provide valuable insights into managing this condition effectively.
Understanding these causes helps predict recovery time. Each factor affects healing. Treatment plans should fit your needs.
Overuse: Strain from activities like running or jumping.
Poor Footwear: Shoes without proper support increase risk.
Sudden Activity Increase: Quick changes in exercise levels can harm.
Knowing about Achilles tendinopathy shows the need for personalized care. We offer expert treatment to guide your recovery. Our plans aim to help you heal fully and regain strength."
Heading,Symptoms and Diagnosis
Paragraph,"Achilles tendinopathy isn’t just a nuisance; it can seriously impact your performance. Recognizing the symptoms early is crucial. Pain is the most common sign, often felt at the back of your ankle. This pain can vary from mild discomfort to severe agony, especially after exercise. Swelling and stiffness also accompany the pain, making it hard to move freely.
Understanding the symptoms helps in the diagnostic process. At Sports Orthopedics Institute, we focus on pinpointing the problem accurately. Our experts conduct a thorough clinical evaluation. This involves reviewing your medical history and checking your physical condition. Imaging techniques, like ultrasound or MRI, provide a clearer picture of the tendon’s state, and these assessments are crucial for determining if surgical intervention, such as Achilles Tendinopathy surgery, is necessary when conservative treatments fail.
Pain: Felt at the back of the ankle, varying in intensity.
Swelling: Noticeable around the heel area.
Stiffness: Especially after periods of inactivity.
Distinguishing between insertional and midportion tendinopathy is important. Insertional tendinopathy affects the lower part of the tendon, where it meets the heel. Midportion tendinopathy occurs higher up. Each type requires different treatment approaches, impacting recovery time.
Early diagnosis and treatment are vital. By catching symptoms early, you can start the right treatment and potentially shorten recovery time. At our institute, we prioritize a tailored approach, ensuring you get back to your activities as soon as possible. Recognizing and addressing the issue promptly leads to better outcomes and a quicker return to your sport. For those experiencing severe symptoms, understanding the process of Achilles tendon repair is essential for effective recovery and long-term health."
Heading,Factors Affecting Recovery Time of Achilles Tendinopathy
Paragraph,"Recovery time for Achilles tendinopathy can vary due to several factors. Some are intrinsic, like age and tendon elasticity. As we age, tendons lose flexibility, which can slow healing. General health also plays a role. A healthy lifestyle supports quicker recovery.
Extrinsic factors include activity level and footwear. High-impact sports or activities can strain the tendon, extending recovery time. Wearing shoes with poor support increases the risk of injury and can delay healing.
Early intervention is crucial. Addressing the issue promptly with the right treatment reduces recovery time. At Sports Orthopedics Institute, we emphasize early diagnosis to speed up the healing process. For those dealing with Achilles tendon issues, understanding the causes and treatments for Achilles tendon and heel pain can be beneficial in managing symptoms effectively.
Understanding the psychological aspect is also important. Fear of movement can hinder recovery. It’s normal to feel apprehensive about returning to activity, but overcoming this fear is part of the healing process."
Heading,Here’s what to consider:
Paragraph,"Age: Older age may slow recovery due to decreased tendon elasticity.
General Health: A healthy lifestyle aids in faster healing.
Footwear: Proper support is key to avoiding delays.
Activity Level: High-impact sports can prolong recovery.
By considering these factors, you can tailor your treatment and manage expectations. At our institute, we guide athletes through personalized care plans to get them back in action swiftly and safely."
Heading,Treatment Options for Achilles Tendinopathy
Paragraph,"Achilles tendinopathy treatment ranges from non-surgical methods to surgical interventions, each tailored to the specific needs of the patient. Non-surgical options are often the first line of defense, focusing on reducing strain and promoting healing. They include simple steps like resting the affected area, applying ice to reduce inflammation, engaging in physical therapy to strengthen surrounding muscles, and using orthotics for better support.
For those dealing with more severe cases, surgical intervention may be necessary. Surgery is considered when conservative treatments don’t provide relief. The procedure is typically done arthroscopically, involving small incisions to remove any bone spurs or deformities and repair the tendon. This is followed by a PRP injection to promote faster healing. For more detailed information on the surgical options available, you can explore our comprehensive guide on Achilles tendon repair surgery, which covers techniques like percutaneous repair and post-surgery rehabilitation strategies."
Heading,Here’s a breakdown of treatment strategies:
Heading,Non-Surgical Options:
Paragraph,"Rest: Take a break from activities that exacerbate pain.
Ice Application: Use to reduce swelling and alleviate pain.
Physical Therapy: Exercises to enhance flexibility and strength.
Orthotics: Custom shoe inserts to provide support."
Heading,Surgical Intervention:
Paragraph,"Arthroscopic Surgery: For severe tendinopathy unresponsive to other treatments.
PRP Injection: Enhances recovery post-surgery.
The choice between non-surgical and surgical methods depends on the severity of the condition and individual patient needs. At Sports Orthopedics Institute, we emphasize personalized care to optimize recovery outcomes, aiming to get you back to your activities with minimal downtime. Understanding the available treatment options empowers patients to make informed decisions about their care."
Heading,Role of Exercise in Recovery
Paragraph,"Exercise is a big part of recovering from Achilles tendinopathy. It helps the tendon heal, builds strength, and reduces pain. Doing the right exercises can make a huge difference in your recovery journey.
Start with progressive tendon loading exercises. These exercises gradually increase the load on your tendon, helping it remodel and get stronger. It’s important to begin with low-impact exercises and slowly increase the intensity. This approach prevents overloading the tendon too quickly."
Heading,Here’s a quick look at what you might do:
Paragraph,"Isometric Exercises: Start with exercises that involve holding positions to build initial strength without much movement.
Eccentric Exercises: Focus on exercises where you control the downward phase of a movement, which helps in strengthening the tendon.
Progressive Load Increase: Gradually add more weight or resistance as your tendon gets stronger.
Sport-Specific Training: Tailor exercises that mimic movements in your sport to prepare for a return to activity.
At Sports Orthopedics Institute, we emphasize personalized exercise regimens. For more insights on how to manage conditions such as Achilles tendon issues and heel pain, you can explore our blogs focused on knee-related orthopedic issues, which also cover various aspects of tendon injuries. These plans are tailored to your specific condition and goals. Understanding exercise’s role in recovery empowers you to actively participate in your rehabilitation. It’s about building a strong foundation for getting back to your favorite activities."
Heading,Preventing Achilles Tendinopathy
Paragraph,"Achilles tendinopathy prevention starts with awareness and smart habits. Recognizing symptoms early and managing them can save you from prolonged downtime. Regular stretching and maintaining fitness are key. Incorporating these into your routine strengthens the tendon and keeps it flexible.
Supportive footwear is essential. Shoes with proper arch support and cushioning reduce strain on the Achilles tendon. Gradually increasing exercise intensity is another important strategy. Sudden jumps in activity levels can be harmful, so ease into new routines.
Biomechanical factors matter. Addressing these can prevent stress on the tendon. Custom orthotics or professional assessments can help if you’re unsure about your biomechanics."
Heading,Here’s a quick list of preventive measures:
Paragraph,"Regular Stretching: Keeps the tendon flexible and strong.
Supportive Footwear: Provides necessary support and cushioning.
Gradual Exercise Increase: Prevents overload by easing into new activities.
Address Biomechanics: Reduces tendon stress through proper alignment.
Implementing these strategies reduces the risk of developing tendinopathy. If an injury does occur, these habits can aid a quicker recovery. Prevention is about consistency and being attentive to your body’s signals. For those dealing with related issues, understanding knee pain in athletes and its treatment options in Bangalore can also be beneficial for maintaining overall lower limb health. Keep your Achilles tendon in top shape by integrating these tips into your lifestyle."
Heading,Monitoring Recovery Progress
Paragraph,"Keeping an eye on your recovery is vital when dealing with Achilles tendinopathy. It helps ensure you’re healing well and making the right choices throughout your treatment journey. At Sports Orthopedics Institute, we emphasize regular monitoring to keep you on track.
One effective way to track progress is through outcome measures. Tools like the VISA-A score are designed to assess symptoms and function in individuals with Achilles tendinopathy. This score helps quantify your pain level and activity limitations, providing a clear picture of your recovery.
Functional assessments are also crucial. The heel-rise test is a practical evaluation method. By observing how well you can perform heel rises, healthcare providers can gauge the strength and endurance of your Achilles tendon.
Regular check-ins with your healthcare provider are important. These appointments allow for adjustments to your treatment plan, ensuring it remains effective. It’s about making sure you’re on the right path and addressing any issues promptly.
For those interested in understanding more about the rehabilitation process, our detailed guide on sports injury rehabilitation in Bangalore offers insights into the collaborative efforts required to restore fitness and mobility levels."
Heading,Here’s what to consider for monitoring:
Paragraph,"VISA-A Score: Assesses symptoms and function related to Achilles tendinopathy.
Heel-Rise Test: Evaluates tendon strength and endurance.
Regular Check-Ins: Allows for treatment adjustments as needed.
By consistently tracking your recovery, you can make informed decisions and potentially speed up your return to sports and activities. Our team is here to support you every step of the way."
Heading,Expected Recovery Times
Paragraph,"Expected recovery times for Achilles tendinopathy can vary depending on the specific condition and individual factors. Patience and sticking to the treatment plan are crucial for a full recovery. Here’s a breakdown of what to expect for different Achilles tendon injuries:
Paratenonitis: This condition involves inflammation of the tissue surrounding the Achilles tendon. Recovery typically takes around 4 to 6 weeks with proper rest, physical therapy, and anti-inflammatory treatments. Adherence to a structured rehabilitation program is key to preventing recurrence.
Insertional Tendinitis: This affects the point where the tendon attaches to the heel bone. Recovery can range from 6 to 12 weeks, depending on the severity. Treatment may include a combination of stretching, strengthening exercises, and orthotics. Consistent follow-up with healthcare providers ensures the best outcomes.
Tendinosis: A degenerative condition of the tendon, tendinosis often requires a longer recovery period, from several months to a year. Treatment involves a mix of eccentric exercises, possibly PRP injections, and gradual activity resumption. Patience and ongoing support are essential here.
Several factors can influence these timelines. Age, overall health, and commitment to rehabilitation all play roles. Early intervention and personalized care, like what we provide at Sports Orthopedics Institute, can positively impact recovery speed. Understanding these timelines helps set realistic expectations, minimizing the risk of setbacks from returning to activities too soon. For more information on similar conditions, you might find our insights on Patellar Tendinopathy knee treatment helpful, especially if experiencing anterior knee pain during activities."
Heading,Key Takeaways on Recovery
Paragraph,"Recognizing Achilles tendinopathy early is essential. Catching symptoms early means you can start treatment sooner, reducing recovery time and preventing complications. It’s about being aware and proactive.
Appropriate treatment is crucial. Whether it’s non-surgical options like rest and physical therapy or surgical interventions for more severe cases, the right approach makes all the difference. Tailoring treatment to individual needs ensures the best outcomes, as highlighted in our expert discussions about ACL treatment options, where we emphasize personalized care based on individual needs.
Preventive strategies can’t be overstated. Regular stretching, proper footwear, and gradual increases in activity levels help maintain tendon health. These habits are key in avoiding injuries and supporting recovery.
Recovery is a journey. It requires patience, commitment, and sometimes professional guidance. Tracking progress through tools like the VISA-A score and regular check-ins with healthcare providers helps keep you on the right path.
Stay informed and proactive. Understand your condition, follow your treatment plan, and make necessary lifestyle adjustments. With the right knowledge and support, you can navigate your recovery process effectively and maintain healthy tendons.
How long does it take for Achilles tendinopathy to heal?
Recovery time for Achilles tendinopathy varies based on several factors, including the severity of the condition and the individual’s health. Generally, mild cases may improve within a few weeks with proper rest and rehabilitation. More severe conditions could take several months to heal fully. At Sports Orthopedics Institute, we focus on early diagnosis and personalized care plans to support faster recovery.
Can I exercise during recovery?
Engaging in the right type of exercise is crucial for recovery from Achilles tendinopathy. Low-impact exercises, such as swimming or cycling, can be beneficial. It’s essential to follow a structured rehabilitation program tailored to your condition. Our team at Sports Orthopedics Institute designs personalized exercise regimens to help you regain strength without overstraining your tendon.
What are the signs that my tendon is healing?
Improvement in symptoms like pain reduction, decreased swelling, and increased range of motion are positive indicators of healing. Regular assessments and feedback from your healthcare provider are important to gauge progress. We at Sports Orthopedics Institute use outcome measures and functional assessments to monitor recovery.
Is surgery necessary for Achilles tendinopathy?
Surgery is generally considered when conservative treatments, such as physical therapy and PRP injections, fail to relieve symptoms. Our institute provides advanced surgical options using minimally invasive techniques if needed, ensuring optimal recovery outcomes.
How can I prevent Achilles tendinopathy from recurring?
Prevention focuses on maintaining flexibility, using supportive footwear, and gradually increasing exercise intensity. Regular stretching and attention to biomechanics are also key. At Sports Orthopedics Institute, we emphasize preventive strategies and ongoing support to maintain healthy tendons."
Heading,Uncategorized
Paragraph,"Core Decompression for AVN: Procedure, Recovery & Benefits"
Heading,Uncategorized
Paragraph,"Insertional Achilles Tendinitis: Causes, Symptoms, and Cure"
Heading,Uncategorized
Heading,Bunion Surgery Recovery: Week by Week Guide